<?xml version="1.0" standalone="no"?>
<!DOCTYPE product_file SYSTEM "../productfiles.dtd">

<!--
    Notes:
        See ../productfiles.dtd in this directory for full notes.  All DTD information
        is contained there.
-->
<product_file>
<product method='basic' name='VIS086'>
    <basic_args>
        <source name='abi'>
            <!-- Veggie band, Near-IR -->
            <var mark_terminator='yes' zenith='yes'>B03Ref</var>
        </source>
        <img>
            <equation>B03Ref</equation>
            <range>
                <min_value>0</min_value>
                <max_value>1.2</max_value>
                <units>Albedo</units>
            </range>
        </img>
        <day_night>day</day_night>
        <cmap>Greys_r</cmap>
        <colorbar>
            <cmap>Greys_r</cmap>
            <ticks>0 .2 .4 .6 .8 1.0 1.2</ticks>
            <title>0.86um, B03Ref</title>
        </colorbar>
        <coastcolor>255 175 0</coastcolor>
        <gridcolor>0 0 0</gridcolor>
    </basic_args>
</product>
</product_file>
