<?xml version="1.0" standalone="no"?>
<!DOCTYPE product_file SYSTEM "../productfiles.dtd">

<!--
    Notes:
        See ../productfiles.dtd in this directory for full notes.  All DTD information
        is contained there.
-->
<product_file>
<product method='external' name='Day-Fires'>
    <external_args>
        <source name='viirs'>
            <var>SVM07Ref</var>
            <var>SVM13BT</var>
            <var>SVM15BT</var>
            <gvar>SunZenith</gvar>
        </source>
        <day_night>day</day_night>
    </external_args>
</product>
</product_file>
