<?xml version="1.0" standalone="no"?>
<!DOCTYPE product_file SYSTEM "../productfiles.dtd">

<!--
    Notes:
        See ../productfiles.dtd in this directory for full notes.  All DTD information
        is contained there.
-->
<product_file>
<product method="basic" name="VIS008">
    <basic_args>
        <source name='seviri'>
            <var zenith='yes'>VIS008</var>
        </source>
        <img>
            <equation>VIS008</equation>
            <range>
                <min_value>0.0</min_value>
                <max_value>100.0</max_value>
                <outbounds>crop</outbounds>
                <units>reflectance</units>
            </range>
            <gamma1>1.5</gamma1>
        </img>
        <day_night>day</day_night>
        <cmap>Greys_r</cmap>
        <coastcolor>0 0 0</coastcolor>
        <gridcolor>0 0 0</gridcolor>
    </basic_args>
</product>
</product_file>
