<?xml version="1.0" standalone="no"?>
<!DOCTYPE product_file SYSTEM "../productfiles.dtd">

<!--
    Notes:
        See ../productfiles.dtd in this directory for full notes.  All DTD information
        is contained there.
        Arunas 20140407 varged celcius to celsius
-->
<product_file>
<product method="basic" name="IR_087">
    <basic_args>
        <source name='seviri'>
            <var>B07BT</var> <!-- 8.4um  B11 ABI   IR_087  8.7um MSG Cloud-Top Phase band, IR                                     -->
        </source>
        <img>
            <equation>B07BT</equation>
            <range>
                <min_value>183</min_value>
                <max_value>303</max_value>
                <outbounds>crop</outbounds>
                <units>kelvin</units>
            </range>
        </img>
        <day_night>both</day_night>
        <cmap>Greys</cmap>
        <colorbar>
            <cmap>Greys</cmap>
            <ticks>-90 -80 -70 -60 -50 -40 -30 -20 -10 0 10 20 30</ticks>
        </colorbar>
        <coastcolor>0 0 0</coastcolor>
        <gridcolor>0 0 0</gridcolor>
    </basic_args>
</product>
</product_file>
