<?xml version="1.0" standalone="no"?>
<!DOCTYPE product_file SYSTEM "../productfiles.dtd">

<!--
    Notes:
        See ../productfiles.dtd in this directory for full notes.  All DTD information
        is contained there.
-->
<product_file>
<product method='basic' name='Infrared'>
    <basic_args>
        <source name='viirs'>
            <var>SVM16BT</var>
        </source>
        <img>
            <equation>SVM16BT</equation>
            <range>
                <min_value>183.15</min_value>
                <max_value>303.15</max_value>
                <units>celsius</units>
            </range>
        </img>
        <day_night>both</day_night>
        <cmap>tcirRev_ascii</cmap>
        <colorbar>
            <cmap>tcirRev_ascii</cmap>
            <ticks>-90 -80 -70 -60 -50 -40 -30 -20 -10 0 10 20 30</ticks>
            <title>11um BT ($^\circ$C)</title>
        </colorbar>
        <coastcolor>0 0 0</coastcolor>
        <gridcolor>0 0 0</gridcolor>
    </basic_args>
</product>
</product_file>
