<?xml version="1.0" standalone="no"?>
<!DOCTYPE product_file SYSTEM "../productfiles.dtd">

<!--
    Notes:
        See ../productfiles.dtd in this directory for full notes.  All DTD information
        is contained there.
-->
<product_file>
<product method='basic' name='Infrared-Gray'>
    <basic_args>
        <source name='ahi'>
            <!--  4um (3.9um)  B07-->
            <!-- 11um (11.2um) B14-->
            <!-- 13um (13.3um) B16-->
            <var zenith='no'>B14BT</var>
        </source>
        <img>
            <equation>B14BT</equation>
            <range>
                <min_value>173</min_value>
                <max_value>323</max_value>
                <outbounds>crop</outbounds>
                <units>K</units>
            </range>
        </img>
        <day_night>both</day_night>
        <cmap>Greys</cmap>
        <coastcolor>255 180 0</coastcolor>
        <gridcolor>255 180 0</gridcolor>
    </basic_args>
</product>
</product_file>
