<?xml version="1.0" standalone="no"?>
<!DOCTYPE product_file SYSTEM "../productfiles.dtd">

<!--
    Notes:
        See ../productfiles.dtd in this directory for full notes.  All DTD information
        is contained there.
-->
<product_file>
<product method='rgb' name='Natural-Color'>
    <rgb_args>
        <source name='viirs'>
            <var>SVI03Ref</var>
            <var>SVI02Ref</var>
            <var>SVI01Ref</var>
            <gvar>SunZenith</gvar>
        </source>
        <red>
            <equation>SVI03Ref</equation>
            <range>
                <min_value>0.0</min_value>
                <max_value>1.0</max_value>
                <units>reflectance</units>
            </range>
            <gamma1>1.0</gamma1>
        </red>
        <grn>
            <equation>SVI02Ref</equation>
            <range>
                <min_value>0.0</min_value>
                <max_value>1.0</max_value>
                <units>reflectance</units>
            </range>
            <gamma1>1.0</gamma1>
        </grn>
        <blu>
            <equation>SVI01Ref</equation>
            <range>
                <min_value>0.0</min_value>
                <max_value>1.0</max_value>
                <units>reflectance</units>
            </range>
            <gamma1>1.0</gamma1>
        </blu>
        <day_night>day</day_night>
        <coastcolor>0 180 0 180</coastcolor>
        <gridcolor>140 60 0 150</gridcolor>
    </rgb_args>
</product>
</product_file>
