<?xml version="1.0" standalone="no"?>
<!DOCTYPE product_file SYSTEM "../productfiles.dtd">

<!--
    Notes:
        See ../productfiles.dtd in this directory for full notes.  All DTD information
        is contained there.
-->
<product_file>
<product method='rgb' name='Night-Vis-IR'>
    <rgb_args>
        <source name='viirs'>
            <var>SVDNBRad</var>
            <var>SVM16BT</var>
            <gvar>SunZenith</gvar>
        </source>
        <red>
            <equation>SVDNBRad</equation>
            <range>
                <min_value>0.0</min_value>
                <max_value>0.000000025</max_value>
                <units>radiance</units>
            </range>
            <gamma1>2.0</gamma1>
        </red>
        <grn>
            <equation>SVDNBRad</equation>
            <range>
                <min_value>0.0</min_value>
                <max_value>0.000000025</max_value>
                <units>radiance</units>
            </range>
            <gamma1>2.0</gamma1>
        </grn>
        <blu>
            <equation>SVM16BT</equation>
            <range>
                <min_value>300.0</min_value>
                <max_value>200.0</max_value>
                <units>kelvin</units>
            </range>
            <gamma1>1.2</gamma1>
        </blu>
        <day_night>night</day_night>
        <coastcolor>0 180 0 180</coastcolor>
        <gridcolor>140 60 0 150</gridcolor>
    </rgb_args>
</product>
</product_file>
