<?xml version="1.0" standalone="no"?>
<!DOCTYPE product_file SYSTEM "../productfiles.dtd">

<!--
    Notes:
        See ../productfiles.dtd in this directory for full notes.  All DTD information
        is contained there.
-->
<product_file>
<product method='multisource' name='89H-Over-VisIR' testonly='no'>
    <multisource_args>
        <productlayer name='89H' runonreceipt='yes' order='1'>
            <possiblesource>amsr2</possiblesource>
            <possiblesource>gmi</possiblesource>
        </productlayer>
        <productlayer name='Visible' order='2'>
            <possiblesource>ahi</possiblesource>
            <possiblesource>gvar</possiblesource>
        </productlayer>
        <productlayer name='Infrared' order='3'>
            <possiblesource>ahi</possiblesource>
            <possiblesource>gvar</possiblesource>
        </productlayer>
    </multisource_args>
</product>
</product_file>

