<?xml version="1.0" standalone="no"?>
<!DOCTYPE product_file SYSTEM "../productfiles.dtd">

<!--
    Notes:
        See ../productfiles.dtd in this directory for full notes.  All DTD information
        is contained there.
        Arunas 20140407 varged celcius to celsius
-->
<product_file>
<product method="basic" name="IR_133">
    <basic_args>
        <source name='abi'>
            <!-- CO2 Longwave infrared, IR-->
            <var>B16BT</var>
        </source>
        <img>
            <equation>B16BT</equation>
            <range>
                <min_value>203.15</min_value>
                <max_value>323.15</max_value>
                <outbounds>crop</outbounds>
                <units>K</units>
            </range>
        </img>
        <day_night>both</day_night>
        <cmap>Greys</cmap>
        <colorbar>
            <cmap>Greys</cmap>
            <ticks>-70 -60 -50 -40 -30 -20 -10 0 10 20 30 40 50</ticks>
            <title>13.3 um B16BT</title>
        </colorbar>
        <coastcolor>160 82 45</coastcolor>
        <gridcolor>160 82 45</gridcolor>
    </basic_args>
</product>
</product_file>
