<?xml version="1.0" standalone="no"?>
<!DOCTYPE product_file SYSTEM "../productfiles.dtd">

<!--
    Notes:
        See ../productfiles.dtd in this directory for full notes.  All DTD information
        is contained there.
-->
<product_file>
<product method='basic' name='Water-Vapor-7p3'>
    <basic_args>
        <source name='seviri'>
            <var>WV_073</var>
        </source>
        <img>
            <equation>WV_073</equation>
            <range>
                <min_value>203.15</min_value>
                <max_value>268.15</max_value>
                <units>K</units>
            </range>
        </img>
        <day_night>both</day_night>
        <cmap>invert-hsl256</cmap>
        <colorbar>
            <cmap>invert-hsl256</cmap>
            <ticks>200 210 220 230 240 250 260 270</ticks>
            <title>7.3um BT ($^\circ$K)</title>
        </colorbar>
        <coastcolor>0 0 0</coastcolor>
        <gridcolor>0 0 0</gridcolor>
    </basic_args>
</product>
</product_file>
