<?xml version="1.0" standalone="no"?>
<!DOCTYPE product_file SYSTEM "../productfiles.dtd">

<!--
    Notes:
        See ../productfiles.dtd in this directory for full notes.  All DTD information
        is contained there.
-->
<product_file>
<product method='basic' name='Visible-Gray' testonly='no'>
    <basic_args>
        <source name='abi'>
        <var>B03Ref</var>
        </source>
        <img>
            <equation>B03Ref</equation>
            <range>
                <min_value>0.0</min_value>
                <max_value>1.0</max_value> 
                <outbounds>crop</outbounds>
                <units></units>
            </range>
            <gamma1>1.5</gamma1>
        </img>
        <day_night>day</day_night>
        <cmap>Greys_r</cmap>
        <max_sat_zen_ang>84</max_sat_zen_ang>
        <coastcolor>255 180 0</coastcolor>
        <gridcolor>255 180 0</gridcolor>
    </basic_args>
</product>
</product_file>
